{"abi_version":1,"authority_generation":"authority-v1-2026-07-29","classes":[{"component_refs":["r4_global_partition_component_v3:0708122436f706bd99e8b730","r4_global_partition_component_v3:dcd9f59fa24cc26f4158faaa","r4_global_partition_component_v3:f65575aa5eab530ba2042e53","r4_global_partition_component_v3:f740c537fed8302d4b9ef8f1"],"label_counts":[{"count":2,"label_ref":"r4_stratification_label_v3:0128dbd1d6063a8644fc59ee"},{"count":2,"label_ref":"r4_stratification_label_v3:014c45b97f5d21da5cc0f61f"},{"count":246,"label_ref":"r4_stratification_label_v3:03544335b52b480975f51eb9"},{"count":2,"label_ref":"r4_stratification_label_v3:048559961978f3577b70aa9c"},{"count":2,"label_ref":"r4_stratification_label_v3:053b662bddbda7d48333799a"},{"count":26,"label_ref":"r4_stratification_label_v3:05633bd6990345b2aa1fbdbb"},{"count":2,"label_ref":"r4_stratification_label_v3:06b1d9c8c7d3a988bf3ddde3"},{"count":26,"label_ref":"r4_stratification_label_v3:07dddab6f7d2db7853aae284"},{"count":2,"label_ref":"r4_stratification_label_v3:089ac7194c0f083fd3784adf"},{"count":5,"label_ref":"r4_stratification_label_v3:0945e873906ab7344a5fdb82"},{"count":116,"label_ref":"r4_stratification_label_v3:0950809a726f00a6b55feda3"},{"count":2,"label_ref":"r4_stratification_label_v3:0955e854b65582079fc8a60c"},{"count":253,"label_ref":"r4_stratification_label_v3:09c607ed152c138ceefcdf0d"},{"count":2,"label_ref":"r4_stratification_label_v3:09e2e4d185583c17b9c4abc6"},{"count":111,"label_ref":"r4_stratification_label_v3:0a4ea02bf52037dae8d7fe25"},{"count":2,"label_ref":"r4_stratification_label_v3:0a76c73f219b7a64c90ccf64"},{"count":3,"label_ref":"r4_stratification_label_v3:0b70c33b3c75de1b1b86f8f9"},{"count":2,"label_ref":"r4_stratification_label_v3:0beba9b8cf26d97718df4eea"},{"count":8,"label_ref":"r4_stratification_label_v3:0c6ca1e8c5825f1b8b2d01a7"},{"count":1,"label_ref":"r4_stratification_label_v3:0d127d153c285c99ce18cfb2"},{"count":2,"label_ref":"r4_stratification_label_v3:0d417a693a1340bd6aa148bf"},{"count":2,"label_ref":"r4_stratification_label_v3:0dbdd7540db48bfbef481234"},{"count":2,"label_ref":"r4_stratification_label_v3:0deb927d0ffb03e2ae2e17ec"},{"count":2,"label_ref":"r4_stratification_label_v3:0e1d94b3c2461aad036dc940"},{"count":2,"label_ref":"r4_stratification_label_v3:0f9c187cf165f7745e4c0f04"},{"count":1,"label_ref":"r4_stratification_label_v3:0fb075b4463a173c94681bee"},{"count":1,"label_ref":"r4_stratification_label_v3:11203dde7a7a77aee4a8d6d3"},{"count":2,"label_ref":"r4_stratification_label_v3:1130eda35130cbacfc52131d"},{"count":2,"label_ref":"r4_stratification_label_v3:11437260df968ae4ea40cca9"},{"count":2,"label_ref":"r4_stratification_label_v3:12b68eb40f21f41d1f0586db"},{"count":2,"label_ref":"r4_stratification_label_v3:13071d8da2e31c519f4fb133"},{"count":1,"label_ref":"r4_stratification_label_v3:1435315cccb1ede43f3d6bcd"},{"count":2,"label_ref":"r4_stratification_label_v3:147ff57584716f3160d91e71"},{"count":2,"label_ref":"r4_stratification_label_v3:15e556ffc327118792946dc6"},{"count":2,"label_ref":"r4_stratification_label_v3:16787a08c34257a6137b74e4"},{"count":1,"label_ref":"r4_stratification_label_v3:1687550d714a9f11d048e5b9"},{"count":2,"label_ref":"r4_stratification_label_v3:171a700c4a43dc868dea0447"},{"count":1,"label_ref":"r4_stratification_label_v3:18077292440583f9036ce9bf"},{"count":69,"label_ref":"r4_stratification_label_v3:1bb6a021588394b2bb617c1f"},{"count":6,"label_ref":"r4_stratification_label_v3:1f1633a5a81d40a60547714e"},{"count":2,"label_ref":"r4_stratification_label_v3:1f61de261f599e620f96c399"},{"count":2,"label_ref":"r4_stratification_label_v3:1f92cb33a6b247d90277b718"},{"count":138,"label_ref":"r4_stratification_label_v3:1fc93c2aa3dbd398b9d9b590"},{"count":2,"label_ref":"r4_stratification_label_v3:1fe522229c99e7edc29bfb59"},{"count":2,"label_ref":"r4_stratification_label_v3:205721fdc254f2127daa040f"},{"count":2,"label_ref":"r4_stratification_label_v3:20778babb7a175fda6231397"},{"count":167,"label_ref":"r4_stratification_label_v3:2143682db83348839349b796"},{"count":2,"label_ref":"r4_stratification_label_v3:21b63699c3a77ff7edf3b0df"},{"count":2,"label_ref":"r4_stratification_label_v3:2361db0805fe121ec62913e1"},{"count":2,"label_ref":"r4_stratification_label_v3:2447e9e1bc31e75b2badd8ef"},{"count":1,"label_ref":"r4_stratification_label_v3:253f10e4cd46da8ce0f181ac"},{"count":2,"label_ref":"r4_stratification_label_v3:2579ea9eba826c97d7b15d72"},{"count":5,"label_ref":"r4_stratification_label_v3:2602c645a481bd36206d005d"},{"count":39,"label_ref":"r4_stratification_label_v3:265a42a4b3fa35ccb44236d8"},{"count":1,"label_ref":"r4_stratification_label_v3:26886189dc08d64894f0ecc8"},{"count":2,"label_ref":"r4_stratification_label_v3:2728a21e0c05f1e19a6b313d"},{"count":2,"label_ref":"r4_stratification_label_v3:273a0170a9b0a84c24130750"},{"count":2,"label_ref":"r4_stratification_label_v3:27b957b3225949665554a2e1"},{"count":5,"label_ref":"r4_stratification_label_v3:27ebcce8e72bba3e74d24a5f"},{"count":2,"label_ref":"r4_stratification_label_v3:286c6db5461d41ef422f59df"},{"count":75,"label_ref":"r4_stratification_label_v3:2887bef9bfbc5c2a7933b246"},{"count":37,"label_ref":"r4_stratification_label_v3:28b6957ef46409582e04259c"},{"count":19,"label_ref":"r4_stratification_label_v3:294fbc8827a411961eecbd21"},{"count":2,"label_ref":"r4_stratification_label_v3:29a83ac780b6b166f8710306"},{"count":2,"label_ref":"r4_stratification_label_v3:29f15e383a9560d56d56ff81"},{"count":151,"label_ref":"r4_stratification_label_v3:2c8fdd4b3da3847d3886e876"},{"count":31,"label_ref":"r4_stratification_label_v3:2dd69059ee6498c305df827f"},{"count":253,"label_ref":"r4_stratification_label_v3:2ddf5900a950fb4880a227c9"},{"count":2,"label_ref":"r4_stratification_label_v3:2dff4450b1ad3fb208a216fe"},{"count":2,"label_ref":"r4_stratification_label_v3:2ebfc6fa124668e26baf06b2"},{"count":2,"label_ref":"r4_stratification_label_v3:2f1cfb8fb70f5478e8f63368"},{"count":2,"label_ref":"r4_stratification_label_v3:2fa9b47f0d0e380432499beb"},{"count":2,"label_ref":"r4_stratification_label_v3:2ffb4c547b1416b521498968"},{"count":2,"label_ref":"r4_stratification_label_v3:3119ab98b92527fc90e83ff4"},{"count":2,"label_ref":"r4_stratification_label_v3:314cff9c3d86190577f0bcc4"},{"count":109,"label_ref":"r4_stratification_label_v3:319ecdfd69cc8b133f687914"},{"count":2,"label_ref":"r4_stratification_label_v3:327fec4f8a57e0c9fc48721b"},{"count":2,"label_ref":"r4_stratification_label_v3:32be4abcde80b28a702f4eb2"},{"count":2,"label_ref":"r4_stratification_label_v3:32c958e4e72f5c2e774b2849"},{"count":2,"label_ref":"r4_stratification_label_v3:3596f74a1d072f07c8050eb7"},{"count":26,"label_ref":"r4_stratification_label_v3:36006a47f2fecdaaebec38d6"},{"count":3,"label_ref":"r4_stratification_label_v3:3617837c25dc1a49996f42da"},{"count":2,"label_ref":"r4_stratification_label_v3:362c8a8f322a13db11037a10"},{"count":28,"label_ref":"r4_stratification_label_v3:3637b1059d95882a7fb2722e"},{"count":138,"label_ref":"r4_stratification_label_v3:3694a12cf84f95d8d623f840"},{"count":2,"label_ref":"r4_stratification_label_v3:36a96c9503f9b649d12eebed"},{"count":2,"label_ref":"r4_stratification_label_v3:36f24fb7425015a2ee78d59d"},{"count":2,"label_ref":"r4_stratification_label_v3:38860dea495269b9d25191de"},{"count":2,"label_ref":"r4_stratification_label_v3:389edd70069b5760b73a28f8"},{"count":2,"label_ref":"r4_stratification_label_v3:3a5e9e4a78e37509f0f65245"},{"count":2,"label_ref":"r4_stratification_label_v3:3ab2b5ba657bc7eb00dde8ff"},{"count":20,"label_ref":"r4_stratification_label_v3:3b56bbe74da9ee5e13e48fd0"},{"count":3,"label_ref":"r4_stratification_label_v3:3bd510cc43cf5cd94693bbf9"},{"count":2,"label_ref":"r4_stratification_label_v3:3dfe1c8e894bb57df4152e37"},{"count":2,"label_ref":"r4_stratification_label_v3:3e935fc4061dd58a0ee83b1e"},{"count":4,"label_ref":"r4_stratification_label_v3:3f76c61ef76d24fca1a27312"},{"count":250,"label_ref":"r4_stratification_label_v3:3fd7214c3f7e65e13d9179db"},{"count":248,"label_ref":"r4_stratification_label_v3:41fe43273d2bd1d466d75277"},{"count":3,"label_ref":"r4_stratification_label_v3:426ce919d0b74b7e9eed7f69"},{"count":2,"label_ref":"r4_stratification_label_v3:432f63993d0622509b46b739"},{"count":2,"label_ref":"r4_stratification_label_v3:435c3402400ad9e619b76bcf"},{"count":6,"label_ref":"r4_stratification_label_v3:44899928f9a4fc617a6ca86e"},{"count":2,"label_ref":"r4_stratification_label_v3:44c39b41259328dbe1483185"},{"count":2,"label_ref":"r4_stratification_label_v3:44e1c54dcfb62725a69c6751"},{"count":19,"label_ref":"r4_stratification_label_v3:450890aef4292ef5ceb1b04a"},{"count":2,"label_ref":"r4_stratification_label_v3:463d1dca7fc845a52f2114de"},{"count":2,"label_ref":"r4_stratification_label_v3:466020e9d592cd610fb16d3e"},{"count":24,"label_ref":"r4_stratification_label_v3:46aaddaec47c93088b5e132d"},{"count":2,"label_ref":"r4_stratification_label_v3:46f779709be2ca8f6e4ab782"},{"count":2,"label_ref":"r4_stratification_label_v3:47ed6dae1ccdd0e181824026"},{"count":6,"label_ref":"r4_stratification_label_v3:47f5012c743b25bdeea446e0"},{"count":2,"label_ref":"r4_stratification_label_v3:48206bf67d91e2fbe03a2cbb"},{"count":24,"label_ref":"r4_stratification_label_v3:485c1ac007350021edb519dd"},{"count":2,"label_ref":"r4_stratification_label_v3:4883ad8e4fc477828f8788af"},{"count":2,"label_ref":"r4_stratification_label_v3:4a253258659f654f3e55e835"},{"count":2,"label_ref":"r4_stratification_label_v3:4b70554ffc7e7eb224c365cb"},{"count":248,"label_ref":"r4_stratification_label_v3:4ccb894e0185147a6dd9f044"},{"count":2,"label_ref":"r4_stratification_label_v3:4e9f2fc7511fc35834355b1c"},{"count":2,"label_ref":"r4_stratification_label_v3:4ea1f3acf9c842439dd29463"},{"count":2,"label_ref":"r4_stratification_label_v3:50ab5320556255782c1f5f87"},{"count":4,"label_ref":"r4_stratification_label_v3:50cce69adc09e190cc578230"},{"count":2,"label_ref":"r4_stratification_label_v3:51428c31e863d91754deb109"},{"count":2,"label_ref":"r4_stratification_label_v3:518fffe19bb5c92ed887ee34"},{"count":2,"l